DHL BÖLGE YAPISI;;;;;;;;;;
1.BÖLGE:Almanya;;;;;;;;;;
2.BÖLGE:Avusturya, Belçika, Bulgaristan, Danimarka, Fransa, Yunanistan, İrlanda Cum., İtalya, Lihtenştayn, Lüksemburg, Monako, Hollanda, Portekiz, İspanya, İsviçre, İngiltere, Vatikan;;;;;;;;;;
3.BÖLGE:Andora, Arnavutluk, Bosna Hersek, Çekya, Estonya, Finlandiya, Cebelitarık, Guernsey, Hırvatistan, Macaristan, İzlanda, Jersey, Kosova, Latviya, Litvanya, Malta, Kuzey Makedonya, Montegero, Norveç, Polonya, Romanya, San Marino, Sırbistan, Slovakya, Slovenya, İsveç;;;;;;;;;;
4.BÖLGE:Amerika Birleşik Devletleri, Kanada, Meksika;;;;;;;;;;
5.BÖLGE:B.Arap Emirlik., Bahreyn, Cezayir, Fas, Irak, İsrail, Ürdün, Kuveyt, Lübnan, Libya, Mısır, Umman, Katar, Suudi Arabistan, Suriye, Tunus, Yemen;;;;;;;;;;
6.BÖLGE:Çin Halk Cum., Hong Kong;;;;;;;;;;
7.BÖLGE:Afganistan, Azerbaycan, Beyaz Rusya, Ermenistan, Grönland, Gürcistan, İran, Kanarya Ada., Kazakistan, Kırgızistan, Moldavya Cumhuriyeti, Moğolistan, Pakistan, Rusya Federasyonu, Tacikistan, Turkmenistan, Ukrayna, Özbekistan, Faroe Adaları;;;;;;;;;;
8.BÖLGE:Avustralya, Bangladeş, Butan, Brunei, Kamboçya, Cook Adaları, Doğu Timor, Endonezya, Fiji, G.Kore Cum., Guam, Hindistan, Japonya, Kiribati, Laos, Makau, Maldivler, Malezya, Mikronezya, Myanmar, Nauru Cumhuriyeti, Nepal, Yeni Zelanda, Niue, Palau, Papua Yeni Gine, Filipinler, Batı Samoa, Singapur, Solomon Adaları, Sri Lanka, Tahiti, Tayland, Tayvan, Tonga, Tuvalu, Vanuatu, Vietnam, Yeni Kaledonya;;;;;;;;;;
9.BÖLGE:Amerikan Samoası, Angola, Anguilla, Antigua, Arjantin, Aruba, Bahamalar, Barbados, Belize, Benin, Bermuda, Bolivya, Bonarya, Botsvana, Brezilya, Burkina Faso, Burundi, Cape Verde, Cayman Adaları, Çad, Şili, Kolombiya, Comoros, Kongo, Kosta Rika, Curacao, Dem. Kongo Cum., Cibuti, Dominika, Dominik Cum., Ekvator, Ekvator Ginesi, El Salvador, Eritre, Etiyopya, Falkland Ada., Fildişi Sahilleri, Gabon, Gambiya, Gana, Grenada, Fransız Guyanası, Guadelup, Guatemala, Gine Bissau, Gine Cum., Guyana, Haiti, Honduras Cum, Jamaika, K. Kore Dem., Kamerun, Kenya, Küba, Liberya, Madagaskar, Malavi, Mali, Marshall Adaları, Martinik, Mauritius, Mayotte Adaları, Moritanya, Mozambik, Namibya, Nijer, Nijerya, Nikaragua, Orta Afrika Cumhuriyeti, Panama, Paraguay, Peru, Porto Riko, Reunion Adası, Ruanda, SAINT HELENA, Saipan, Sao Tome Ve Principe, Senegal, Seyşeller, Sierra Leone, Somali, Somaliland Cumhuriyeti, Güney Afrika, Güney Sudan, St Barthelemy, St Eustatius, St Kitts, St Lucia, St Maarten, St Vincent, Sudan, Surinam, Swaziland, Tanzanya, Togo, Trinidad Ve Tobago, Türk Ve Kaikos Adaları, Uganda, Uruguay, Vanuatu, Venezuela, Virjin Adaları(ABD), Virjin Adaları(UK), Zambiya, Zimbabve;;;;;;;;;; 